{
  "threads": [
    {
      "id": "deep_copy_in_lisp:_how?",
      "title": "Deep copy in lisp: how?",
      "posts": [
        {
          "id": "3164291289641126@naggum.no",
          "subject": "Re: Deep copy in lisp: how?",
          "author_id": "erik_naggum",
          "date": "2000-04-09",
          "display_date": "04/09/2000",
          "content": "\nSubject: Re: Deep copy in lisp: how?\nFrom: Erik Naggum <erik@naggum.no>\nDate: 2000/04/09\nNewsgroups: comp.lang.lisp\nMessage-ID: <3164291289641126@naggum.no>\n\n* Courageous <jkraska1@san.rr.com>\n| I have a CLOS object which may contain an arbitrary graph of other\n| objects.  This graph may be cyclic.  I'm looking for an easy way to deep\n| copy the object.\n\n  the only easy way out is to write a copier that knows what it's doing.\n  any easier way out would violate \"as simple as possible, but no simpler\".\n\n| I've been told that generic deep copy might be implementing by writing\n| the object to a stream, and then reading back from that stream.\n\n  you've been told that?  what a joker that must have been!  how do you\n  think you would proceed to implement readers and writers for the objects?\n  do you think _they_ come in generic versions that do everything right?\n\n  (for the languages where you may use a generic version that does it wrong\n  most of the time, which you usuallyq observe if you try, there _is_ the\n  merit to this language design that most \"modern programmers\" (= dummies)\n  are a lot happier when they something out and see it fail, then do it\n  \"right\" (= less _obviously_ wrong), than to know it would fail and know\n  they had to do it right from the start.)\n\n  implementing a mechanism that avoids descending into cyclic structures is\n  amazingly easy.  detection is easy with the rabbit and the hare algorithm.\n  a hash table of copied objects avoids all possible problems to begin with.\n\n#:Erik\n\n",
          "references": [],
          "thread_id": "deep_copy_in_lisp:_how?"
        },
        {
          "id": "3164297272958870@naggum.no",
          "subject": "Re: Deep copy in lisp: how?",
          "author_id": "erik_naggum",
          "date": "2000-04-09",
          "display_date": "04/09/2000",
          "content": "\nSubject: Re: Deep copy in lisp: how?\nFrom: Erik Naggum <erik@naggum.no>\nDate: 2000/04/09\nNewsgroups: comp.lang.lisp\nMessage-ID: <3164297272958870@naggum.no>\n\n* Courageous <jkraska1@san.rr.com>\n| I know this is possible one way or the other, for I have seen automatic\n| deep copy implemented via code generation in C++.\n\n  I'm sorry, but you have been tricked.  just because it exists for C++ is\n  not in any way, shape, or form an argument for the _correctness_ of the\n  implementation or the algorithm or even the concept to begin with.\n\n| I'm pretty new at lisp; however, so I'm not sure what language-specific\n| pitfalls I will encounter yet.\n\n  you encountered a language-specific pitfall and fell headlong into it\n  when you believed that C++ had an automatic solution.  you will get out\n  of this sorry state of affairs when you realize that such automated tools\n  are not able to do their job.  the key to understand this is that even in\n  a class for which \"deep copy\" makes non-zero sense, you don't _always_\n  want to deep copy _everything_, and if you fail to implement it right,\n  you will in fact destroy valuable information in the copying process.\n\n#:Erik\n\n",
          "references": [],
          "thread_id": "deep_copy_in_lisp:_how?"
        },
        {
          "id": "3164355240918791@naggum.no",
          "subject": "Re: Deep copy in lisp: how?",
          "author_id": "erik_naggum",
          "date": "2000-04-10",
          "display_date": "04/10/2000",
          "content": "\nSubject: Re: Deep copy in lisp: how?\nFrom: Erik Naggum <erik@naggum.no>\nDate: 2000/04/10\nNewsgroups: comp.lang.lisp\nMessage-ID: <3164355240918791@naggum.no>\n\n* Courageous <jkraska1@san.rr.com>\n| Never had that happen is all of 3 years using the code generator that I\n| had, which would, in fact, copy wildly crazy and cyclic graphs of objects\n| perfectly correctly.\n\n  that's a ridiculously bold statement.  how do you _know_?  would you even\n  have _seen_ an error if it occurred?\n\n| Furthermore, if you look into the world of object oriented databases,\n| you'll find that various oodbs also do this perfectly well.\n\n  they do it by restricting the domain to fit what they implement, but it\n  fits the C++ mind-set to think this way and take it for granted that\n  others will understand that \"of _course_ we don't do the hard stuff\".  in\n  this newsgroup and in Lisp, the trivial problems are uninspiring, and so\n  we tend to think in broader terms.  this means that arbitrary limits are\n  regarded as cheating, unless yo present the limited domain up front as\n  inherent engineering decisions.  did you do that?  no.  foo on you for\n  that.\n\n| Perhaps we're having a definition of terms problem?\n\n  yes, you come from the C++ world.  C++ people are extremely arrogant the\n  way they think they invented object-orientedness.  they didn't, OK?  C++\n  doesn't even touch upon the really hard areas.  you have to face this\n  fact, or you'll make more ridiculously bold statements that reflect very\n  badly on your ability to deal with complexity.\n\n| I can't write a specific graph copier, because I don't have a- priori\n| knowledge of the structure of the objects that I will be copying.\n\n  at issue is knowing the _intent_ of the slots, not which they are.  in\n  Common Lisp we have the MOP to ask for the structure of the objects.\n  piece of cake, really.  just like databases can report on such things.\n  it doesn't help one bit in deciding whether to make a shallow or deep\n  copy, though.\n\n#:Erik\n\n",
          "references": [],
          "thread_id": "deep_copy_in_lisp:_how?"
        },
        {
          "id": "3164355492179483@naggum.no",
          "subject": "Re: Deep copy in lisp: how?",
          "author_id": "erik_naggum",
          "date": "2000-04-10",
          "display_date": "04/10/2000",
          "content": "\nSubject: Re: Deep copy in lisp: how?\nFrom: Erik Naggum <erik@naggum.no>\nDate: 2000/04/10\nNewsgroups: comp.lang.lisp\nMessage-ID: <3164355492179483@naggum.no>\n\n* Courageous <jkraska1@san.rr.com>\n| A tip for some of you folks: one of the keys to successful\n| communication is not to assume that the other person is wrong,\n| but rather to figure out what they're right *for*.\n \n  do you follow this tip yourself?  if so, how come you don't listen?\n  it seems to me you're telling us we're wrong because you have \"seen\"\n  something you believe is sufficient when it isn't.\n\n  a tip for tippers: follow them yourself first, to _show_ how they work\n  well for you.  if not, just shut up about the tips.\n\n#:Erik\n\n",
          "references": [],
          "thread_id": "deep_copy_in_lisp:_how?"
        },
        {
          "id": "3164356890914970@naggum.no",
          "subject": "Re: Deep copy in lisp: how?",
          "author_id": "erik_naggum",
          "date": "2000-04-10",
          "display_date": "04/10/2000",
          "content": "\nSubject: Re: Deep copy in lisp: how?\nFrom: Erik Naggum <erik@naggum.no>\nDate: 2000/04/10\nNewsgroups: comp.lang.lisp\nMessage-ID: <3164356890914970@naggum.no>\n\n* Philip Lijnzaad <lijnzaad@ebi.ac.uk>\n| On 09 Apr 2000 17:48:09 +0000, \n| \"Erik\" == Erik Naggum <erik@naggum.no> writes:\n| \n| Erik> implementing a mechanism that avoids descending into cyclic structures is\n| Erik> amazingly easy.  \n| \n| if slightly non-obvious at first. For those confused, you have two parts of\n| your function step through the elements of a list, one going in single steps,\n| the other in steps of two. If they ever end up in the same element, the list\n| must have been circular.\n| \n| Erik> detection is easy with the rabbit and the hare algorithm.\n| \n| Is this an optimized version of the tortoise and the hare algorithm? \n\n  yes (my silly mistake).  you just described it in the above paragraph, so\n  you must know it under a different name, but the key is to realize that\n  it only _detects_ a circularity, after it has happened -- there is no\n  guarantee that you find the first such element.\n\n#;Erik\n\n",
          "references": [],
          "thread_id": "deep_copy_in_lisp:_how?"
        },
        {
          "id": "3164446697303504@naggum.no",
          "subject": "Re: Deep copy in lisp: how?",
          "author_id": "erik_naggum",
          "date": "2000-04-11",
          "display_date": "04/11/2000",
          "content": "\nSubject: Re: Deep copy in lisp: how?\nFrom: Erik Naggum <erik@naggum.no>\nDate: 2000/04/11\nNewsgroups: comp.lang.lisp\nMessage-ID: <3164446697303504@naggum.no>\n\n* Courageous <jkraska1@san.rr.com>\n| I mentioned the possibility of restrictions in my second message\n| in this very thread. Did you read it? No. Foo on you for that.\n\n  this is just great.  of course I did that, and that's _why_ I criticize\n  you for not doing it UP FRONT.  perhaps you do ont know what \"UP FRONT\"\n  means?  well, it means you do it at the very start of your request for\n  help.  sort of like \"I use XLISP, and have this problem\" instead of just\n  asking people to guess based on the lack of intelligibility of the\n  problem as stated in the environments smart people use.\n\n  please go back to C++, both communities would benefit from that.\n\n#:Erik\n\n",
          "references": [],
          "thread_id": "deep_copy_in_lisp:_how?"
        },
        {
          "id": "3164550783316675@naggum.no",
          "subject": "Re: Deep copy in lisp: how?",
          "author_id": "erik_naggum",
          "date": "2000-04-12",
          "display_date": "04/12/2000",
          "content": "\nSubject: Re: Deep copy in lisp: how?\nFrom: Erik Naggum <erik@naggum.no>\nDate: 2000/04/12\nNewsgroups: comp.lang.lisp\nMessage-ID: <3164550783316675@naggum.no>\n\n* Courageous <jkraska1@san.rr.com>\n| Yes, it does.  Some of us do, in fact, work on real problems which need\n| solving.  Theoretical constraints are interesting and valuable to know,\n| but the project moves on.\n\n  just because you cannot fathom the theoretical implications of your\n  questions does not mean that those who do don't solve practical problems.\n  think about this.  please.\n\n  and, incidentally, if I have \"made\" you feel like an idiot, why not just\n  do something that would put such impressions to _shame_ instead of going\n  out of your way to _prove_ that you really _are_ hopelessly lost?\n\n| I suspect that you need to look inward and not outward to solve the\n| problem that you need to work on. Usenet won't offer your ego what it's\n| looking for, no matter how hard you look for it.\n\n  I'm sure you and your shrink have worked something out that works for you\n  (although by the looks of it, you have some ways to go), but just like he\n  or she should have told you that you shouldn't give other people your\n  medication, you also shouldn't believe that your personal problems apply\n  to other people.\n\n  but I'll give you this: you are indeed courageous.  I know of few other\n  people who would expose themselves the way you do.  here's a hint: you\n  really don't need to -- nobody cares about _you_, personally, and it's an\n  affront to your audience, _any_ audience, to think they do.\n\n#:Erik\n\n",
          "references": [],
          "thread_id": "deep_copy_in_lisp:_how?"
        },
        {
          "id": "3164522187493376@naggum.no",
          "subject": "Re: Deep copy in lisp: how?",
          "author_id": "erik_naggum",
          "date": "2000-04-12",
          "display_date": "04/12/2000",
          "content": "\nSubject: Re: Deep copy in lisp: how?\nFrom: Erik Naggum <erik@naggum.no>\nDate: 2000/04/12\nNewsgroups: comp.lang.lisp\nMessage-ID: <3164522187493376@naggum.no>\n\n* Courageous <jkraska1@san.rr.com>\n| It doesn't matter.  I have a practical problem to solve, here.\n\n  thank you.  I think this sums up your position admirably.\n\n#:Erik\n\n",
          "references": [],
          "thread_id": "deep_copy_in_lisp:_how?"
        },
        {
          "id": "3164643995219305@naggum.no",
          "subject": "Re: Deep copy in lisp: how?",
          "author_id": "erik_naggum",
          "date": "2000-04-13",
          "display_date": "04/13/2000",
          "content": "\nSubject: Re: Deep copy in lisp: how?\nFrom: Erik Naggum <erik@naggum.no>\nDate: 2000/04/13\nNewsgroups: comp.lang.lisp\nMessage-ID: <3164643995219305@naggum.no>\n\n* Tim Moore <moore@herschel.bricoworks.com>\n| Topics such as \"How do I do a deep copy in Lisp?\" cause blood pressures\n| to rise because Lispers know it's impossible, but that's because the\n| language is much richer and exposes one to situations where deep copy is\n| in fact quite hard if not impossible.\n\n  you're missing the point, as one would expect from a bystander.  it isn't\n  the _topic_ that cause any problems.  it's the dimwits who come here and\n  ask for advice, and resoundingly _reject_ the advice they get from\n  well-meaning, highly educated people who try to teach pigs to sing, which\n  we know wastes your time and annoys the pig (witness the \"practical\" line\n  that just _had_ to come our way) only they don't know the dimwits they\n  try to help _are_ pigs until after a while, and then they get annoyed\n  when the pig turns out to be severely limited in learning _ability_, too.\n\n#:Erik\n\n",
          "references": [],
          "thread_id": "deep_copy_in_lisp:_how?"
        },
        {
          "id": "3164632179269337@naggum.no",
          "subject": "Re: Deep copy in lisp: how?",
          "author_id": "erik_naggum",
          "date": "2000-04-13",
          "display_date": "04/13/2000",
          "content": "\nSubject: Re: Deep copy in lisp: how?\nFrom: Erik Naggum <erik@naggum.no>\nDate: 2000/04/13\nNewsgroups: comp.lang.lisp\nMessage-ID: <3164632179269337@naggum.no>\n\n* tom__98@my-deja.com\n| Unlike equality, where it matters if you compare too much, for the\n| semantics of a deep copy, it doesn't matter if you copy too much--it will\n| simply be inefficient.\n\n  when object identity matters, copying too much is destroying information.\n  such destruction can lead to very serious errors that are impossible to\n  trace after the fact.  if you don't get it right, you're hosed.  if you\n  don't even recognize that you can get this wrong, you're hosed a priori.\n  such is the tragic case for that hack we've been trying to teach there's\n  more to life than his C++ wonderworld.\n\n  (do we really _need_ to educate people at this level in this newsgroup?)\n\n#:Erik\n\n",
          "references": [],
          "thread_id": "deep_copy_in_lisp:_how?"
        },
        {
          "id": "3164649925932789@naggum.no",
          "subject": "Re: Deep copy in lisp: how?",
          "author_id": "erik_naggum",
          "date": "2000-04-13",
          "display_date": "04/13/2000",
          "content": "\nSubject: Re: Deep copy in lisp: how?\nFrom: Erik Naggum <erik@naggum.no>\nDate: 2000/04/13\nNewsgroups: comp.lang.lisp\nMessage-ID: <3164649925932789@naggum.no>\n\n* Tim Moore <moore@herschel.bricoworks.com>\n| Pigs are highly intelligent.\n\n  pardon me for elaborating on a saying.  speaking of which, this must be a\n  regional thing -- in some parts of the English-speaking world, people\n  tend to use idioms almost constantly, but do not reflect on them at all,\n  which makes them into a mere set of ersatz vocabulary, while in other\n  parts of the English-speaking world, puns and elaborations and mixing and\n  matching idioms and expressions to travel between many layers of meaning\n  is considered natural.  I tend to be puzzled when I meet people who don't\n  reflect on their language, because it's hard to tell which part of the\n  many meanings they got and which they completely missed out on.\n\n| In any event, who cares if the recipient isn't receptive?\n\n  you do, when you take the role of a bystander and raise the discussion to\n  a meta-level.  others do, when they are in middle of the discussion that\n  started it all.  many find it very annoying to see recurring dimwits fail\n  to get over a personal hangup or their desperately trying to recover\n  something they are the only ones to remember they lost.\n\n  newsgroup volume is a measure of discontent.\n\n#:Erik\n\n",
          "references": [],
          "thread_id": "deep_copy_in_lisp:_how?"
        },
        {
          "id": "3164646548558686@naggum.no",
          "subject": "Re: Deep copy in lisp: how?",
          "author_id": "erik_naggum",
          "date": "2000-04-13",
          "display_date": "04/13/2000",
          "content": "\nSubject: Re: Deep copy in lisp: how?\nFrom: Erik Naggum <erik@naggum.no>\nDate: 2000/04/13\nNewsgroups: comp.lang.lisp\nMessage-ID: <3164646548558686@naggum.no>\n\n* Tom Breton <tob@world.std.com>\n| Apparently he can't.\n\n  Microsoft hired Ralph Reed of Christian Coalition fame as their lobbyist\n  in Washington to get George Dubya to be favorable to their antitrust\n  lawsuit.  this was widely considered a serious mistake, especially after\n  the New York Times uncovered it.\n\n  I haven't hired Tom Breton as my spokesman or lobbyist, but it would be\n  the same kind of mistake if I had.\n\n  so, can _you_ stop, Tom?  but we know the answer: \"apparently he can't\".\n\n#:Erik\n\n",
          "references": [],
          "thread_id": "deep_copy_in_lisp:_how?"
        },
        {
          "id": "3164610602078761@naggum.no",
          "subject": "Re: Deep copy in lisp: how?",
          "author_id": "erik_naggum",
          "date": "2000-04-13",
          "display_date": "04/13/2000",
          "content": "\nSubject: Re: Deep copy in lisp: how?\nFrom: Erik Naggum <erik@naggum.no>\nDate: 2000/04/13\nNewsgroups: comp.lang.lisp\nMessage-ID: <3164610602078761@naggum.no>\n\n* Courageous <jkraska1@san.rr.com>\n| Take a step back.\n\n  let me know when your advice has worked for you.  make an effort to show\n  that you can listen to anything but your own voice while you're at it.\n\n#:Erik\n\n",
          "references": [],
          "thread_id": "deep_copy_in_lisp:_how?"
        },
        {
          "id": "3164603059346977@naggum.no",
          "subject": "Re: Deep copy in lisp: how?",
          "author_id": "erik_naggum",
          "date": "2000-04-13",
          "display_date": "04/13/2000",
          "content": "\nSubject: Re: Deep copy in lisp: how?\nFrom: Erik Naggum <erik@naggum.no>\nDate: 2000/04/13\nNewsgroups: comp.lang.lisp\nMessage-ID: <3164603059346977@naggum.no>\n\n* Courageous <jkraska1@san.rr.com>\n| You just can't stop, can you Erik?\n\n  if I can stop you, that's good enough for me, because I don't start the\n  kind of insane drivel you seem to enjoy starting.  but have you asked\n  yourself your own question, lately?  I don't appreciate your line of\n  psychologizing crap, but now that you get it back in your face, I see\n  that you are a lot more sensitive to the matter than I am, which is good,\n  because you may realize that if you plan to win any games that way, you\n  won't do it here, and you're clearly the kind of moron who needs to be\n  hurt to stop to think.  will _that_ make you stick to your issues,\n  whatever they may be, or will you smear more of your personality all over\n  the place with yet more moronic psychologizing and irrelevant personal\n  attacks?  it's your call, \"Courageous\".\n\n#:Erik\n\n",
          "references": [],
          "thread_id": "deep_copy_in_lisp:_how?"
        },
        {
          "id": "3164713468970761@naggum.no",
          "subject": "Re: Deep copy in lisp: how?",
          "author_id": "erik_naggum",
          "date": "2000-04-14",
          "display_date": "04/14/2000",
          "content": "\nSubject: Re: Deep copy in lisp: how?\nFrom: Erik Naggum <erik@naggum.no>\nDate: 2000/04/14\nNewsgroups: comp.lang.lisp\nMessage-ID: <3164713468970761@naggum.no>\n\n* Fernando <spamers@must.die>\n| Just like the proliferation of parens, he may be a minor annoyance to\n| newbies, but fortunately, parens stop annoying you in a week, and as soon\n| as you plonk him, he'll stop annoying you. ;-)\n\n  but how long before the obsessed stalkers stop annoying the newsgroup?\n\n#:Erik\n\n",
          "references": [],
          "thread_id": "deep_copy_in_lisp:_how?"
        },
        {
          "id": "3164777262564002@naggum.no",
          "subject": "Re: Deep copy in lisp: how?",
          "author_id": "erik_naggum",
          "date": "2000-04-15",
          "display_date": "04/15/2000",
          "content": "\nSubject: Re: Deep copy in lisp: how?\nFrom: Erik Naggum <erik@naggum.no>\nDate: 2000/04/15\nNewsgroups: comp.lang.lisp\nMessage-ID: <3164777262564002@naggum.no>\n\n* Courageous <jkraska1@san.rr.com>\n| However, it's funny. At my place of work, I'm the one all the newbies\n| come to for answers, because I understand ...\n\n  I'm sure you think you're the hero of your work-place, but it doesn't\n  help just to _tell_ people when you have done so much damage to your\n  public impression as you have, and as a line of self-defense, it's so\n  pathetic it stinks.  _anyone_ could write a self-serving self-appraisal.\n  that's why people _don't_ write such personal defenses on the Net -- it's\n  self-defeating and on top of it, it's embarrassing when those \"newbies\"\n  who came to you for answers ask you something you don't know and search\n  for the answer on the Net, only to find that you don't have a clue in\n  some very important areas and are incredibly self-defensive and personal\n  about it.  to really top it off, you haven't understood _any_ of the many\n  very good explanations you have received to your question.  such arrogant\n  ignorance is a very questionable quality in an employee who doles out\n  answers to helpless \"newbies\" in an organization.  so you should start to\n  worry about yourself, and much less about others: if you can't take care\n  of yourself, you certainly are in no position to give advice to others.\n\n| More rhetorically, I wonder if the people over at Franz will be \"morons\"\n| if they attempt to implement the Objects By Value section of the CORBA\n| standard in their ORBLink product?\n\n  why do you want to hurt yourself so much?  you didn't have to _prove_\n  that you still have not understood the difference between implementing a\n  carefully constrained specification of a protocol and _general_ deep\n  copier, did you?  normal people don't insist on making the same mistake\n  over and over just because they don't like being called morons when they\n  do and continue with it until they are no longer called morons (it works\n  the other way around, in case you wonder).  the people over at Franz have\n  understood this difference long ago (like at _least_ 15 years ago), and\n  are in no danger at all of being called morons.  and in case you wonder\n  about more things, smart people who don't defend themselves can disagree\n  violently without even the hint of a danger of getting personal, so even\n  if implementing CORBA _were_ a really moronic thing to do, that itself\n  doesn't mean someone who does it is a moron.  it's the getting _personal_\n  that is the first hint of someone being a moron.  you have never quit\n  giving that hint, on the contrary: you have reinforced it over and over,\n  and this is a pretty strong argument that it is a correct assessment of\n  your mental acuity and childish, retarded stubbornness.  you can change\n  this by snapping out of your \"personal\" mental state and realize that\n  your ego is not under attack from anyone other than your own imagination.\n  most everyone here will utter a sigh of relief if you get the idea, and\n  nobody will ever \"remind\" you of your past mistake when you have learned\n  -- that's what makes possibly heated technical discussions _impersonal_\n  to people who aren't morons.\n\n  I'm _expecting_ another knee-jerk moronic response.  surprise me.  (of\n  course, now that I said that, your childish stubbornness prohibits you\n  from showing any trace of adult, smart behavior, but try, anyway.)\n\n#:Erik\n\n",
          "references": [],
          "thread_id": "deep_copy_in_lisp:_how?"
        },
        {
          "id": "3164898799599994@naggum.no",
          "subject": "Re: Deep copy in lisp: how?",
          "author_id": "erik_naggum",
          "date": "2000-04-16",
          "display_date": "04/16/2000",
          "content": "\nSubject: Re: Deep copy in lisp: how?\nFrom: Erik Naggum <erik@naggum.no>\nDate: 2000/04/16\nNewsgroups: comp.lang.lisp\nMessage-ID: <3164898799599994@naggum.no>\n\n* Courageous <jkraska1@san.rr.com>\n| You're complaining about *me* making matters personal.\n| Oh, that's rich. Between the two of us, who's posting\n| page-long diatribes sometimes filled with profanity?\n\n  well, here's the clue: _you_ take it personally.  _you_ cannot even\n  imagine that it _isn't_ personal, but that's _your_ choice.  you don't\n  have to make this choice.  so make another choice if you aren't satisfied\n  with it.  if you _are_ satisfied with your choice, and still complain,\n  you do in fact merit the personal insults and the label \"moron\" and much,\n  much more and much, much worse assessments of your mental state.\n\n| Says he who fills up pages with insults & profanity...\n\n  obviously, _you_ have a personal problem with what _you_ think is insults\n  and profanity because your wiener brain makes you see _nothing_ else if\n  this trigger is fired within you.  this is not somebody else's problem.\n  so just _deal_ with it if you don't like its consequences for you.\n\n  I take it that you are happy with your choice to take negative comments\n  personally and as destructively for yourself as possible, and so want\n  others to stop making negative comments that you could take personally.\n  face that facts, moron: that's not going to happen when you post as much\n  evidence of stupidity as you do.\n\n#:Erik\n\n",
          "references": [],
          "thread_id": "deep_copy_in_lisp:_how?"
        },
        {
          "id": "3164940726622243@naggum.no",
          "subject": "Re: Deep copy in lisp: how?",
          "author_id": "erik_naggum",
          "date": "2000-04-17",
          "display_date": "04/17/2000",
          "content": "\nSubject: Re: Deep copy in lisp: how?\nFrom: Erik Naggum <erik@naggum.no>\nDate: 2000/04/17\nNewsgroups: comp.lang.lisp\nMessage-ID: <3164940726622243@naggum.no>\n\n* Courageous <jkraska1@san.rr.com>\n| You mean like when you say things like \"fucking retarded\" and\n| moronic and ah \"wiener brain\", and so on?\n\n  for once a personal comment: I pity you.  such insecurity as you suffer\n  from should have been protected from public exposure and treated with\n  love and professional care.  a clue: you won't get that here.\n\n  here's a another clue: you care what I think about you, but I don't think\n  about you -- only your moronic actions bother me.  how could I possibly\n  respond to anything else?  oh, forget that, I'm asking the one person\n  here who is unable to distinguish the actions from the person acting.\n  \n#:Erik\n\n",
          "references": [],
          "thread_id": "deep_copy_in_lisp:_how?"
        },
        {
          "id": "3164984947664175@naggum.no",
          "subject": "Re: Deep copy in lisp: how?",
          "author_id": "erik_naggum",
          "date": "2000-04-17",
          "display_date": "04/17/2000",
          "content": "\nSubject: Re: Deep copy in lisp: how?\nFrom: Erik Naggum <erik@naggum.no>\nDate: 2000/04/17\nNewsgroups: comp.lang.lisp\nMessage-ID: <3164984947664175@naggum.no>\n\n* Courageous <jkraska1@san.rr.com>\n| You just can't stop, can you, Erik?\n\n  interestingly, this started with a general deep copier and the first\n  thing I told you about was detection of circularities.  I detect with\n  some satisfaction that you walk around in very small circles and ask the\n  same moronic questions over and over.  when will you realize it?\n\n  but now is the time we will learn whether you stop or prove again that\n  you are obsessing like the other morons who have visited this newsgroup.\n\n  since day 1, I have told you this: try some non-moronic behavior if you\n  want people to think differently about you.  this is obviously impossible\n  for you to fathom, and instead keep acting the moron because you want\n  others to stop calling you a moron before you change your moronic ways.\n\n  but sure, I can stop _calling_ you a moron, but that won't change you.\n  after all is said and done, I have said \"moron\", and you _are_ a moron.\n  is this really going to help you, you pitiful \"Courageous\" moron?\n\n  now, repeat another question for you own amusement.\n\n#:Erik\n\n",
          "references": [],
          "thread_id": "deep_copy_in_lisp:_how?"
        },
        {
          "id": "3165044217260009@naggum.no",
          "subject": "Re: Deep copy in lisp: how?",
          "author_id": "erik_naggum",
          "date": "2000-04-18",
          "display_date": "04/18/2000",
          "content": "\nSubject: Re: Deep copy in lisp: how?\nFrom: Erik Naggum <erik@naggum.no>\nDate: 2000/04/18\nNewsgroups: comp.lang.lisp\nMessage-ID: <3165044217260009@naggum.no>\n\n* Courageous <jkraska1@san.rr.com>\n| This isn't going to compensate for it, you know.\n\n  I said I was going to stop calling you a \"moron\".  YOUR WISH HAS BEEN\n  GRANTED!  so why do you continue with the same behavior that caused the\n  label you do not want attached yourself?  we have already established\n  that the best you think you can do in a debate is to count words, for\n  instance.  do as you were told to in the very beginning: try something\n  better, or face the consequences: people will _know_ you can't do better.\n\n  this is not going to stop until you start to behave smart.  this may take\n  a while, but the only goal I have with someone like you in this newsgroup\n  is to make them stop acting in certain ways.  if you are impervious to\n  any sort of outside signal to improve your behavior, it doesn't help what\n  I say or not -- it may in fact hurt you that I don't state my conclusion.\n\n#:Erik\n\n",
          "references": [],
          "thread_id": "deep_copy_in_lisp:_how?"
        },
        {
          "id": "3165123380936230@naggum.no",
          "subject": "Re: Deep copy in lisp: how?",
          "author_id": "erik_naggum",
          "date": "2000-04-19",
          "display_date": "04/19/2000",
          "content": "\nSubject: Re: Deep copy in lisp: how?\nFrom: Erik Naggum <erik@naggum.no>\nDate: 2000/04/19\nNewsgroups: comp.lang.lisp\nMessage-ID: <3165123380936230@naggum.no>\n\n* Courageous <jkraska1@san.rr.com>\n| One simply ceases.\n\n  I'm waiting for you to stop behaving in a way that needs correction.\n\n  as you have so succinctly stated, \"you can't stop, can you, Joe Kraska\"?\n  I think we have all the proof we need.  it's up to you.  in fact, it has\n  been up to you for a very long time, but your insistence on proving your\n  case has been a barrier to progress.  I draw my conclusions, but I have\n  promised to stop stating them, so won't.\n\n#:Erik\n\n",
          "references": [],
          "thread_id": "deep_copy_in_lisp:_how?"
        },
        {
          "id": "3165302496305278@naggum.no",
          "subject": "Re: Deep copy in lisp: how?",
          "author_id": "erik_naggum",
          "date": "2000-04-21",
          "display_date": "04/21/2000",
          "content": "\nSubject: Re: Deep copy in lisp: how?\nFrom: Erik Naggum <erik@naggum.no>\nDate: 2000/04/21\nNewsgroups: comp.lang.lisp\nMessage-ID: <3165302496305278@naggum.no>\n\n* Courageous <jkraska1@san.rr.com>\n| One of the hallmark signs of an abuser is blaming the victim.\n\n  the hallmark of a loser is one who has thoughts of \"blame\" and \"victim\"\n  and \"abuser\" and all that shit and who seems himself in one particular\n  role relative to others.  snap out of it!\n\n  no one is blaming you for anything.  you are simply being told that your\n  actions have certain consequences.  you seem to subscribe to this view,\n  yet refuse to apply it to yourself.  I find this highly indicative of\n  what I have concluded about you.  you have been told that if you don't\n  want the consequences, you should change the actions.  you refuse to\n  change your pattern of being a hapless victim and go on and on and on\n  about everything bad happening to you being my fault.  you victimize\n  _yourself_ and work very hard to _remove_ responsibility from yourself.\n  such is the hallmark of a loser without hope of recovery, but I think\n  that has been the fairly well established pattern from you already.\n\n  the problem with you is you can't stop feeling the victim, even when it's\n  clear that you're running after _me_ with your unceasing desire to blame\n  me for your _personal_ problems.  I'm not responsible for your reactions.\n  you have to accept responsibility for your own _part_ in everything that\n  happens to you and not try to shift it to somebody else.  doing so is,\n  indeed, highly indicative of what I have already concluded about you.\n\n  the big test is whether you get over this.  so far, you have not, and\n  neither has Tom Breton and a few other \"victims\".  they have another\n  thing in common: all been very seriously mistaken in some particular\n  area.  I find it very interesting that being persistently wrong about\n  something causes _some_ people to fall into the \"victim\" trap (in their\n  own mind) and never get out of it, while those who want to understand\n  accept technical counter-information the first time it is presented and\n  _learn_ from it.  people who refuse to learn, however, fall into another\n  category which is unlikely to be respected for much, and even less when\n  they start to blame others and use \"I'm a victim!\" language.\n\n  I now understand why you need to _call_ yourself \"Courageous\".\n\n#:Erik\n\n",
          "references": [],
          "thread_id": "deep_copy_in_lisp:_how?"
        },
        {
          "id": "3165322206168072@naggum.no",
          "subject": "Re: Deep copy in lisp: how?",
          "author_id": "erik_naggum",
          "date": "2000-04-21",
          "display_date": "04/21/2000",
          "content": "\nSubject: Re: Deep copy in lisp: how?\nFrom: Erik Naggum <erik@naggum.no>\nDate: 2000/04/21\nNewsgroups: comp.lang.lisp\nMessage-ID: <3165322206168072@naggum.no>\n\n* Courageous <jkraska1@san.rr.com>\n\n  while you continue your abuse, I'm waiting for your message-ID with the\n  favorite quoted text of yours which you attribute to me.\n\n#:Erik\n\n",
          "references": [],
          "thread_id": "deep_copy_in_lisp:_how?"
        },
        {
          "id": "3165321443490104@naggum.no",
          "subject": "Re: Deep copy in lisp: how?",
          "author_id": "erik_naggum",
          "date": "2000-04-21",
          "display_date": "04/21/2000",
          "content": "\nSubject: Re: Deep copy in lisp: how?\nFrom: Erik Naggum <erik@naggum.no>\nDate: 2000/04/21\nNewsgroups: comp.lang.lisp\nMessage-ID: <3165321443490104@naggum.no>\n\n* Courageous <jkraska1@san.rr.com>\n| Oh, and let's not forget my favorite:\n| \n| ... who deserves to be hurt.\n| \n| Very revealing that one, especially.\n| \n| You say I am an abuser? Say again?\n\n  since this one is so important to you and so important not to _forget_,\n  could you be bothered to actually locate it among what I have said to\n  you?  a message-ID will be very helpful.  a URL at deja.com will work.\n\n  if you find that I have NOT actually said that, you will admit to be a\n  moron, a liar, and a disgusting creep who is out to misrepresent others\n  in such a way as to make others look bad when in fact you are a piece of\n  reeking, self-victimizing crap yourself.\n\n  if you do find that I HAVE actually said that, I'll admit to being a\n  psychopathic abuser who has actually been out to destroy your sterling\n  reputation as a genius within BBN for no good reason.\n\n  do we have a deal, Joe \"Courageous\" Kraska?\n\n  I believe \"very revealing\" are extremely interesting words from our\n  supposed \"victim\".  the psychology of most victims is that the world\n  consists of abusers and victims, and if you aren't a victim, you are an\n  abuser.  the _fact_, however, is that every abuser is a victim and every\n  victim is an abuser.  the question is towards and with whom they have\n  their respective roles.  those who do not subscribe to this set of roles,\n  are actually neither abusers _nor_ victims.\n\n  so, what will your search _reveal_, Joe \"Victim\" Kraska?\n\n#:Erik\n\n",
          "references": [],
          "thread_id": "deep_copy_in_lisp:_how?"
        },
        {
          "id": "3165384579368198@naggum.no",
          "subject": "Re: Deep copy in lisp: how?",
          "author_id": "erik_naggum",
          "date": "2000-04-22",
          "display_date": "04/22/2000",
          "content": "\nSubject: Re: Deep copy in lisp: how?\nFrom: Erik Naggum <erik@naggum.no>\nDate: 2000/04/22\nNewsgroups: comp.lang.lisp\nMessage-ID: <3165384579368198@naggum.no>\n\n* Tom Breton <tob@world.std.com>\n| I had to tell him very basic stuff about optimization.\n\n  you still haven't read what I have written about optimization, and you\n  repeat the same idiotic comments that were proven wrong by others, but\n  pretend that I'm the only one who doesn't \"agree\" with you.  the fact is,\n  however, that _nobody_ agrees with you, but you, like any moron deserving\n  the label, decided in your own sick, demented mind, that I'm to blame for\n  your lack of brains.  this is just as brilliant as your incredibly stupid\n  ideas about optimization.\n\n#:Erik\n\n",
          "references": [],
          "thread_id": "deep_copy_in_lisp:_how?"
        },
        {
          "id": "3165414841017864@naggum.no",
          "subject": "Re: Deep copy in lisp: how?",
          "author_id": "erik_naggum",
          "date": "2000-04-22",
          "display_date": "04/22/2000",
          "content": "\nSubject: Re: Deep copy in lisp: how?\nFrom: Erik Naggum <erik@naggum.no>\nDate: 2000/04/22\nNewsgroups: comp.lang.lisp\nMessage-ID: <3165414841017864@naggum.no>\n\n* Courageous <jkraska1@san.rr.com>\n| Oh, and let's not forget my favorite:\n| \n| ... who NEEDS to be hurt.\n| \n| Very revealing that one, especially.\n| \n| You say I am an abuser? Say again?\n\n  others have pointed out that you're the abuser.  I'm gleefully picking up\n  on that, of course, as they are in fact right, but you would never listen\n  to them if I said it first.  I'm happy you're defensive about it, though.\n\n  incidentally, but mostly for the search engines: the full quote is \"you\n  are the kind of moron who needs to be hurt to stop to think\", Joe Kraska.\n  our society punishes destructive morons who have no respect for others.\n  if you are so retarded that you _still_ cannot fathom that this is very\n  different from your nightmarish imagination of what it is, you're also\n  clinically psychotic and probably _unable_ to distinguish reality from\n  your sick imagination.\n\n#:Erik\n\n",
          "references": [],
          "thread_id": "deep_copy_in_lisp:_how?"
        }
      ],
      "post_count": 26,
      "first_post_date": "2000-04-09",
      "last_post_date": "2000-04-22"
    },
    {
      "id": "[specialized_arrays]_which_lisp_has_them?",
      "title": "[specialized arrays] which lisp has them?",
      "posts": [
        {
          "id": "3165302816800445@naggum.no",
          "subject": "Re: [specialized arrays] which lisp has them?",
          "author_id": "erik_naggum",
          "date": "2000-04-21",
          "display_date": "04/21/2000",
          "content": "\nSubject: Re: [specialized arrays] which lisp has them?\nFrom: Erik Naggum <erik@naggum.no>\nDate: 2000/04/21\nNewsgroups: comp.lang.lisp\nMessage-ID: <3165302816800445@naggum.no>\n\n* Tunc Simsek <simsek@tudor.EECS.Berkeley.EDU>\n| This is important because the recent tool matlisp relies on (simple-array\n| double-float (*)) and that the array must have C doubles contiguous in\n| memory.\n\n  could you explain why you rely on such low-level representational issues?\n\n#:Erik\n\n",
          "references": [],
          "thread_id": "[specialized_arrays]_which_lisp_has_them?"
        },
        {
          "id": "3165409740471698@naggum.no",
          "subject": "Re: [specialized arrays] which lisp has them?",
          "author_id": "erik_naggum",
          "date": "2000-04-22",
          "display_date": "04/22/2000",
          "content": "\nSubject: Re: [specialized arrays] which lisp has them?\nFrom: Erik Naggum <erik@naggum.no>\nDate: 2000/04/22\nNewsgroups: comp.lang.lisp\nMessage-ID: <3165409740471698@naggum.no>\n\n* \"Sunil Mishra\" <smishra@arslogica.com>\n| I remember reading the announcement for matlisp. Apparently it provides OO\n| facilities for working with matrices using the BLAS and LAPACK libraries,\n| high performance matrix algebra libraries orginally written in Fortran.\n| Therefore the requirements.\n\n  well, from that follows the requirements _in the FFI_, but not the native\n  representation.  I see no reason whatsoever to require the native Common\n  Lisp system to represent arrays or matrices like this, but it is obvious\n  that the ability to access arrays or matrices represented like this from\n  Common Lisp when they were declared/created/whatever from or in the FFI,\n  is a requirement of the system as a whole.\n\n#:Erik\n\n",
          "references": [],
          "thread_id": "[specialized_arrays]_which_lisp_has_them?"
        }
      ],
      "post_count": 2,
      "first_post_date": "2000-04-21",
      "last_post_date": "2000-04-22"
    },
    {
      "id": "on_the_quality_of_this_newsgroup,_was:_re:_deep_co",
      "title": "On the quality of this newsgroup, was: Re: Deep copy in lisp: how?",
      "posts": [
        {
          "id": "3164963670328673@naggum.no",
          "subject": "Re: On the quality of this newsgroup, was: Re: Deep copy in lisp: how?",
          "author_id": "erik_naggum",
          "date": "2000-04-17",
          "display_date": "04/17/2000",
          "content": "\nSubject: Re: On the quality of this newsgroup, was: Re: Deep copy in lisp: how?\nFrom: Erik Naggum <erik@naggum.no>\nDate: 2000/04/17\nNewsgroups: comp.lang.lisp\nMessage-ID: <3164963670328673@naggum.no>\n\n* Ian Upright <ian@oneaccordinc.com>\n| As a Smalltalker who doesn't read this newsgroup very often, I was quite\n| irritated by Mr. Naggum's absurd and highly inflamitory opinions.\n\n  I'm glad you agree that being quite irritated at other people's absurd\n  and highly inflammatory opinions is perfectly acceptable.\n\n| Are all Lisper's f***ing belligerent ass*****?  ;-)\n\n  no, but all visiting smalltalkers might perhaps be, based on the usual\n  sample of one to support generalizations.  smiley or no smiley, such\n  flaws in methodology or complete lack of methodological thinking is at\n  the core of my criticism.  people who lack the ability, or who have never\n  been trained, to think methodologically, make mistakes that nothing short\n  of fixing their methodology can change.  most intelligent people pick up\n  on this relatively fast when required to.  morons think they have a right\n  to make even less methodolically sound claims when criticized.\n\n| I still don't understand what the problem is.\n\n  well, that's odd, since you illustrated it well when you took it for\n  granted that certain object types in Smalltalk are simply not copied.\n\n#:Erik\n\n",
          "references": [],
          "thread_id": "on_the_quality_of_this_newsgroup,_was:_re:_deep_co"
        },
        {
          "id": "3165044910752775@naggum.no",
          "subject": "Re: On the quality of this newsgroup, was: Re: Deep copy in lisp: how?",
          "author_id": "erik_naggum",
          "date": "2000-04-18",
          "display_date": "04/18/2000",
          "content": "\nSubject: Re: On the quality of this newsgroup, was: Re: Deep copy in lisp: how?\nFrom: Erik Naggum <erik@naggum.no>\nDate: 2000/04/18\nNewsgroups: comp.lang.lisp\nMessage-ID: <3165044910752775@naggum.no>\n\n* Jon S Anthony <jsa@synquiry.com>\n| The amazing thing about this whole discussion is that this should be even\n| a remotely interesting point, let alone one capable of generating all\n| this irrelevant heat.\n\n  not at all.  some people will forever refuse to listen to the truth, if a\n  notion they have is from a source regarded as somehow \"superior\" to those\n  they would have to listen to to hear the truth.  these are non-technical\n  people, incapable of dealing with technical issues without dealing with\n  people, in the shape of trusting other people's conclusions before they\n  think on their own.  what other people say to such people is immensely\n  important to them, but you have to be the right person to say the right\n  thing before they will accept it.  refusing to think in this particular\n  way is always a source of heat, because to the people who do not want to\n  listen to the truth, it's a people issue, not a technical issue at all,\n  and to those who want to explain the truth, it never could be a people\n  issue to begin with.\n\n#:Erik\n\n",
          "references": [],
          "thread_id": "on_the_quality_of_this_newsgroup,_was:_re:_deep_co"
        },
        {
          "id": "3165123882306994@naggum.no",
          "subject": "Re: On the quality of this newsgroup, was: Re: Deep copy in lisp: how?",
          "author_id": "erik_naggum",
          "date": "2000-04-19",
          "display_date": "04/19/2000",
          "content": "\nSubject: Re: On the quality of this newsgroup, was: Re: Deep copy in lisp: how?\nFrom: Erik Naggum <erik@naggum.no>\nDate: 2000/04/19\nNewsgroups: comp.lang.lisp\nMessage-ID: <3165123882306994@naggum.no>\n\n* Courageous <jkraska1@san.rr.com>\n| Life's not like that, Erik.\n\n  we're not talking about your _life_ here.  grow a clue, now.\n\n#:Erik\n\n",
          "references": [],
          "thread_id": "on_the_quality_of_this_newsgroup,_was:_re:_deep_co"
        },
        {
          "id": "3165302603471097@naggum.no",
          "subject": "Re: On the quality of this newsgroup, was: Re: Deep copy in lisp: how?",
          "author_id": "erik_naggum",
          "date": "2000-04-21",
          "display_date": "04/21/2000",
          "content": "\nSubject: Re: On the quality of this newsgroup, was: Re: Deep copy in lisp: how?\nFrom: Erik Naggum <erik@naggum.no>\nDate: 2000/04/21\nNewsgroups: comp.lang.lisp\nMessage-ID: <3165302603471097@naggum.no>\n\n* Courageous <jkraska1@san.rr.com>\n| No, Erik. It's life in general.\n\n  a loser victim explains \"life in general\"...\n\n  why should I take _your_ word for it, of all the people I could listen to?\n\n  feel free to live your loser victim life, Joe Kraska.  keep me out of it.\n\n#:Erik\n\n",
          "references": [],
          "thread_id": "on_the_quality_of_this_newsgroup,_was:_re:_deep_co"
        }
      ],
      "post_count": 4,
      "first_post_date": "2000-04-17",
      "last_post_date": "2000-04-21"
    },
    {
      "id": "how_does_lisp_implement_primitive,_structured_and_",
      "title": "How does Lisp implement Primitive, Structured and User-defined data  types?",
      "posts": [
        {
          "id": "3165125538003989@naggum.no",
          "subject": "Re: How does Lisp implement Primitive, Structured and User-defined data  types?",
          "author_id": "erik_naggum",
          "date": "2000-04-19",
          "display_date": "04/19/2000",
          "content": "\nSubject: Re: How does Lisp implement Primitive, Structured and User-defined data  types?\nFrom: Erik Naggum <erik@naggum.no>\nDate: 2000/04/19\nNewsgroups: comp.lang.lisp\nMessage-ID: <3165125538003989@naggum.no>\n\n* Lisp Researcher\n| I am doing a research on Lisp and I need to know...\n\n* Courageous <jkraska1@san.rr.com>\n| I suggest you get a copy of the ANSI Common Lisp\n| standards document.\n\n  sigh.  this is a genuinely bad idea for the answers to the questions\n  asked, which have to do with implementation of the language, not the\n  specification of the semantics of the language.  anyone who has _read_\n  the standard knows that it doesn't answer any of the questions.\n\n  the answer is obviously to call up a Lisp vendor and ask a technical\n  person for some pointers.  I don't think the question merits response\n  beyond that, mainly because I don't want people who have zero clue to\n  start doing research on anything.  acquire clue, _then_ do research.\n  otherwise, you ask clueless questions, get clueless answers from people\n  who have even less clue than you do, and don't recognize the problems\n  inherent in trusting the Net.\n\n#:Erik\n\n",
          "references": [],
          "thread_id": "how_does_lisp_implement_primitive,_structured_and_"
        },
        {
          "id": "3165303464872531@naggum.no",
          "subject": "Re: How does Lisp implement Primitive, Structured and User-defined data   types?",
          "author_id": "erik_naggum",
          "date": "2000-04-21",
          "display_date": "04/21/2000",
          "content": "\nSubject: Re: How does Lisp implement Primitive, Structured and User-defined data   types?\nFrom: Erik Naggum <erik@naggum.no>\nDate: 2000/04/21\nNewsgroups: comp.lang.lisp\nMessage-ID: <3165303464872531@naggum.no>\n\n* Courageous <jkraska1@san.rr.com>\n| That's the point: once you've read the standard, you'll realize that for\n| *Lisp*, there is no answer.  Only a particular vendors solution.  But\n| that isn't Lisp, now, is it?\n\n  I'm disappointed.  I was waiting for a \"Lisp is not like that, Erik\".\n\n  I must assume from past experience that you won't ever understand that\n  giving somebody the standard is not an answer to implementation issues,\n  but will now proceed to call yourself \"victim\" and me \"abuser\" for\n  pointing this out to you, and _blame_ me for your lack of understanding.\n\n  instead of _actually_ going down that route, I'll just summarize it for\n  us all: Joe Kraska will never relinquish the genuinely bad idea of giving\n  someone the whole standard when they ask for _common_ implementations of\n  certain aspects of Common Lisp, but will forever think his was a highly\n  meritorious suggestion which was undeservedly bashed.  it is still wrong.\n\n  now, refrain from following up, Joe Kraska.  we know what you will say.\n\n#:Erik\n\n",
          "references": [],
          "thread_id": "how_does_lisp_implement_primitive,_structured_and_"
        }
      ],
      "post_count": 2,
      "first_post_date": "2000-04-19",
      "last_post_date": "2000-04-21"
    },
    {
      "id": "getting_a_full_symbol_name",
      "title": "getting a full symbol name",
      "posts": [
        {
          "id": "3165125191606936@naggum.no",
          "subject": "Re: getting a full symbol name",
          "author_id": "erik_naggum",
          "date": "2000-04-19",
          "display_date": "04/19/2000",
          "content": "\nSubject: Re: getting a full symbol name\nFrom: Erik Naggum <erik@naggum.no>\nDate: 2000/04/19\nNewsgroups: comp.lang.lisp\nMessage-ID: <3165125191606936@naggum.no>\n\n* \"Marc Battyani\" <Marc_Battyani@csi.com>\n| what is the easiest way to get a full symbol name ie \"package::name\"?\n\n(let ((*package* (find-package :keyword))\n  (write-to-string object :readably t)))\n\n| is there a format directive for this?\n\n(defun fqsn (stream object colon-p atsign-p &rest format-args)\n  (declare (ignore colon-p atsign-p format-args))\n  (let ((*package* (find-package :keyword))\n    (write object :stream stream :readably t))))\n\n  now there is.  fqsn stands for fully qualified symbol name.\n\n(format nil \"~/fqsn/\" <symbol>)\n\n#:Erik\n\n",
          "references": [],
          "thread_id": "getting_a_full_symbol_name"
        },
        {
          "id": "3165124054834383@naggum.no",
          "subject": "Re: getting a full symbol name",
          "author_id": "erik_naggum",
          "date": "2000-04-19",
          "display_date": "04/19/2000",
          "content": "\nSubject: Re: getting a full symbol name\nFrom: Erik Naggum <erik@naggum.no>\nDate: 2000/04/19\nNewsgroups: comp.lang.lisp\nMessage-ID: <3165124054834383@naggum.no>\n\n* Barry Margolin <barmar@genuity.net>\n| If you bind *PACKAGE* to NIL, ...\n\n  ... you are violating a system-wide invariant.  just don't do it.\n\n#:Erik\n\n",
          "references": [],
          "thread_id": "getting_a_full_symbol_name"
        },
        {
          "id": "3165303001598092@naggum.no",
          "subject": "Re: getting a full symbol name",
          "author_id": "erik_naggum",
          "date": "2000-04-21",
          "display_date": "04/21/2000",
          "content": "\nSubject: Re: getting a full symbol name\nFrom: Erik Naggum <erik@naggum.no>\nDate: 2000/04/21\nNewsgroups: comp.lang.lisp\nMessage-ID: <3165303001598092@naggum.no>\n\n* Gareth McCaughan <Gareth.McCaughan@pobox.com>\n| Very elegant, but it doesn't work if the symbol you're passed is actually\n| a keyword!\n\n  yes, it does.\n\n#:Erik\n\n",
          "references": [],
          "thread_id": "getting_a_full_symbol_name"
        }
      ],
      "post_count": 3,
      "first_post_date": "2000-04-19",
      "last_post_date": "2000-04-21"
    },
    {
      "id": "how_to_validate_input?",
      "title": "how to validate input?",
      "posts": [
        {
          "id": "3165126075587849@naggum.no",
          "subject": "Re: how to validate input?",
          "author_id": "erik_naggum",
          "date": "2000-04-19",
          "display_date": "04/19/2000",
          "content": "\nSubject: Re: how to validate input?\nFrom: Erik Naggum <erik@naggum.no>\nDate: 2000/04/19\nNewsgroups: comp.lang.lisp\nMessage-ID: <3165126075587849@naggum.no>\n\n* Friedrich Dominicus <Friedrich.Dominicus@inka.de>\n| I have written the same with a loop but it looks IMO more ugly.\n\n  it's quite strange, but people who have been trained to write iteration\n  using tail recursion tend to write the most amazingly ugly loops, and it\n  isn't a question of lack of training in writing loops, it's conceptual.\n  (yet another case of Scheme hurting people.)\n\n| (defun get-input ()\n| (let ((line))\n|   (do ((exit nil))\n|       (exit line)\n|     (format t \"Please give me a number (e for Exit): \")\n|     (setf line (read))\n|     (if (numberp line)\n|         (progn \n|           (setf exit t)\n|           line)\n|       (when (y-or-n-p \"Not a number, really exit?\")\n|         (setf exit t)\n|         (setf line nil))))))\n\n(format t \"please enter a number: \")\n(do ((input (read nil nil nil) (read nil nil nil)))\n    ((or (null input) (numberp input)) input)\n  (format t \"not a number, try again: \"))\n\n  I'd use a different input function that read, but that's your call.\n\n#:Erik\n\n",
          "references": [],
          "thread_id": "how_to_validate_input?"
        }
      ],
      "post_count": 1,
      "first_post_date": "2000-04-19",
      "last_post_date": "2000-04-19"
    },
    {
      "id": "setf_&_setq_-_revisiting",
      "title": "setf & setq - revisiting",
      "posts": [
        {
          "id": "3164940958803214@naggum.no",
          "subject": "Re: setf & setq - revisiting",
          "author_id": "erik_naggum",
          "date": "2000-04-17",
          "display_date": "04/17/2000",
          "content": "\nSubject: Re: setf & setq - revisiting\nFrom: Erik Naggum <erik@naggum.no>\nDate: 2000/04/17\nNewsgroups: comp.lang.lisp\nMessage-ID: <3164940958803214@naggum.no>\n\n* ;; h e l m e r . . . <assemblage@my-deja.com>\n| i'm revisitng my initial question because i found something on a scheme\n| site that clarifies (i hope) and gives me very basic definitions,\n| probelm is, i have to make sure it's lisp too . . .\n\n  it isn't.  on top of it, it's completely bogus, because ...\n\n| [note i have taken these statements where sheme's 'define' = 'setf' in\n| lisp and similarly 'set!' = 'setq']\n\n  ... this is completely unfounded.\n\n  please forget comparing Scheme and Lisp for now, but feel free to try\n  again when you know both exceedingly well on their own merits.\n\n#:Erik\n\n",
          "references": [],
          "thread_id": "setf_&_setq_-_revisiting"
        }
      ],
      "post_count": 1,
      "first_post_date": "2000-04-17",
      "last_post_date": "2000-04-17"
    },
    {
      "id": "r:_newbie_question_about_symbols",
      "title": "R: newbie question about symbols",
      "posts": [
        {
          "id": "3164962988991097@naggum.no",
          "subject": "Re: R: newbie question about symbols",
          "author_id": "erik_naggum",
          "date": "2000-04-17",
          "display_date": "04/17/2000",
          "content": "\nSubject: Re: R: newbie question about symbols\nFrom: Erik Naggum <erik@naggum.no>\nDate: 2000/04/17\nNewsgroups: comp.lang.lisp\nMessage-ID: <3164962988991097@naggum.no>\n\n* \"Vanna\" <vgalaffu@tiscalinet.it>\n| we will try to explain more clearly what we would like to do:\n| we deal with a package where are defined some functions that receive some\n| symbols and compare these symbols with other internal symbols;\n\n  that's not what you would _like_ to do, it's exactly what you do, and as\n  an explanation, it's useless for those who want to help you.  what you\n  would like to do is, as a guess, to refer to symbols without a pacakge\n  because you have failed to understand the package system.  this is not\n  that uncommon, but insisting that the package system is broken is only\n  half as common.\n\n  instead of using symbols internal in a given package, use keywords.\n\n| (defparameter *somesymbols* '(FOO1 FOO2 FOO3))\n\n(defparameter *somesymbols* '(:FOO1 :FOO2 :FOO3))\n\n| (search-symbol 'FOO1)\n\n(search-symbol :FOO1)\n=> T\n\n| We are wondering why it is so difficult to deal with symbols defined in\n| different packages, we think that this problem is common to many other\n| Lisp users that want to take advantage of using different packages.\n\n  this arrogance has blocked your progress both in solving the problem and\n  in recognizing the difficulties you have experienced.  you have to let go\n  of the idea that you're doing something right if it doesn't work, and at\n  the very least investigate your options.\n\n#:Erik\n\n",
          "references": [],
          "thread_id": "r:_newbie_question_about_symbols"
        }
      ],
      "post_count": 1,
      "first_post_date": "2000-04-17",
      "last_post_date": "2000-04-17"
    },
    {
      "id": "loop_syntax",
      "title": "Loop Syntax",
      "posts": [
        {
          "id": "3164119940843690@naggum.no",
          "subject": "Re: Loop Syntax",
          "author_id": "erik_naggum",
          "date": "2000-04-07",
          "display_date": "04/07/2000",
          "content": "\nSubject: Re: Loop Syntax\nFrom: Erik Naggum <erik@naggum.no>\nDate: 2000/04/07\nNewsgroups: comp.lang.lisp\nMessage-ID: <3164119940843690@naggum.no>\n\n* \"Jeffrey P. Sandys\" <sandysj@asme.org>\n| Should loop keywords have the colon prefix keyword syntax?\n\n  a very good question.  only the symbol-name of the loop keywords are used\n  by the macro function, so you're free to use keyword symbols.  it might\n  look odd to some people, but I find serious merit in using a distinct\n  syntax for this as long as we can't use a more Lispy syntax to begin with.\n\n#:Erik\n\n",
          "references": [],
          "thread_id": "loop_syntax"
        },
        {
          "id": "3164399680432945@naggum.no",
          "subject": "Re: Loop Syntax",
          "author_id": "erik_naggum",
          "date": "2000-04-10",
          "display_date": "04/10/2000",
          "content": "\nSubject: Re: Loop Syntax\nFrom: Erik Naggum <erik@naggum.no>\nDate: 2000/04/10\nNewsgroups: comp.lang.lisp\nMessage-ID: <3164399680432945@naggum.no>\n\n* Tom Breton <tob@world.std.com>\n| Well, I don't seriously mean to tar everyone in cll ...\n\n  sure, but that's OK, Tom, you're only tarring yourself, anyway.\n\n  being wrong sometimes has the _unexplainable_ effect that other people\n  _continue_ to argue against you.  isn't that just too _weird_, Tom?\n\n#:Erik\n\n",
          "references": [],
          "thread_id": "loop_syntax"
        },
        {
          "id": "3164646276653331@naggum.no",
          "subject": "Re: Loop Syntax",
          "author_id": "erik_naggum",
          "date": "2000-04-13",
          "display_date": "04/13/2000",
          "content": "\nSubject: Re: Loop Syntax\nFrom: Erik Naggum <erik@naggum.no>\nDate: 2000/04/13\nNewsgroups: comp.lang.lisp\nMessage-ID: <3164646276653331@naggum.no>\n\n* Tom Breton <tob@world.std.com>\n| Sorry, Erik is absolutely not someone you want to cite on optimization.\n\n  I'm fascinated that you optimized your journey from ignorance to opinion\n  by removing the normally required task of _reading_ what you opine on.\n  this reflects on most of your other opinions on optimization, a least\n  with me, because I optimize away the incredibly unrewarding task of\n  trying to get past your personal hangups with people you don't agree\n  with, which you might learn a little bit about if you read what I have\n  written on _agreement_ as part of the process of argumentation, but it is\n  by now fairly obvious that you also  optimize away what other people call\n  \"learning experience\".\n\n  sigh.  just get over it, Tom.  I don't like being so important in some\n  dreadful morons' lives as I am in yours and this \"Courageous\" fellow.\n\n#:Erik\n\n",
          "references": [],
          "thread_id": "loop_syntax"
        },
        {
          "id": "3164660350780584@naggum.no",
          "subject": "Re: Loop Syntax",
          "author_id": "erik_naggum",
          "date": "2000-04-14",
          "display_date": "04/14/2000",
          "content": "\nSubject: Re: Loop Syntax\nFrom: Erik Naggum <erik@naggum.no>\nDate: 2000/04/14\nNewsgroups: comp.lang.lisp\nMessage-ID: <3164660350780584@naggum.no>\n\n* Erik Naggum\n| sigh.  just get over it, Tom.  I don't like being so important in some\n| dreadful morons' lives as I am in yours and this \"Courageous\" fellow.\n\n* Courageous <jkraska1@san.rr.com>\n| Given the long chains of invective, cursing, put downs, and outright\n| temper tantrums I've been subject to one both usenet and long personal\n| email messages -- and the apologetic email I've received from the group\n| explaining that you have an established tendancy to behave the way you do\n| (were you aware that people thought of you that way?)     ... *well*.\n\n  you missed the relevant part, of course.  _you_ make me important in\n  _your_ lives.  you don't have to, yet you complain bitterly when you do,\n  and you refuse to understand that it's your very own choice to do so.\n\n  when your have reached the point in your life when _you_ become important\n  to yourself the way I am to you now, you will thank me, in your own way.\n  until then, you will hate me, or something more or less indistinguishable\n  from hate.  _that_ is the established tendency.  of course, you won't\n  believe this now, but that's _why_ I'm important to you: you _need_ to be\n  preoccupied with me and you _need_ to continue to post so much insane\n  drivel about me from inside your _own_ psyche it will make you very, very\n  embarrassed when you realize what you've done, instead of the simple and\n  easy thing you _could_ do, but which _you_ only tell other people as a\n  piece of advice you'll never follow yourself: look inside yourself.\n  there's something inside you that makes me important to you.  find it!\n\n  understandably, however, you are right now at the point where the only\n  thing that matters to you is to keep enlightenment from occuring to you,\n  and the more you can preoccupy yourself with _me_, the less you will be\n  enlightened.  once you understand, fundamentally, emotionally, and fully\n  that spending any energy at all on other _people_ is a matter of choice\n  that reflects concern, personal bonding, and apprecation for something\n  you often do not understand when it happens, you will be prepared to let\n  go of _people_ and focus on _ideas_, which will enable you to concentrate\n  on those few people that _really_ matter to you, as you will know why.\n\n  however, I don't want anything to do with _you_, yet this very rejection\n  is what drives you like a madman to keep sending me mail that is also\n  rejected, keep replying to articles, keep _preoccupying_ yourself with\n  me.  I want you morons to shut up and _listen_, not to _me_, but to _any_\n  source of englightenment you can find that will cause you to grow up and\n  relieve me of the burden of having to reject your pathetic attempts to\n  ingratiate yourself with me.  it's not _about_ me, you morons, it's about\n  what I trigger _inside_ of you, whatever the hell it is -- I wish I knew,\n  because then maybe I could get a little _control_ over your sycophants,\n  like perhaps giving me all your money, but I'm joking, of course.\n\n  and if you found this nauseating enough to read that you stop stalking me\n  with your sniveling little \"please love me!\" messages, so much the better!\n  I shall appreciate it highly when you reach enlightenment, as interaction\n  between the enlightened is always such a pleasure, but until then, you're\n  nothing but an ignorent, annoying pest attracted to the nearest source of\n  light.  seek elsewhere, you moths-for-brains, but above all: seek!\n\n#:Erik\n-- \n  statistically, only 1 in 250 people understood anything in this message.\n\n",
          "references": [],
          "thread_id": "loop_syntax"
        },
        {
          "id": "3164692830791331@naggum.no",
          "subject": "Re: Loop Syntax",
          "author_id": "erik_naggum",
          "date": "2000-04-14",
          "display_date": "04/14/2000",
          "content": "\nSubject: Re: Loop Syntax\nFrom: Erik Naggum <erik@naggum.no>\nDate: 2000/04/14\nNewsgroups: comp.lang.lisp\nMessage-ID: <3164692830791331@naggum.no>\n\n* Courageous <jkraska1@san.rr.com>\n| Seeing another full page ego-fest of a dissertation, I would\n| wager that it's the other way around by a long shot. If you're\n| like this in real life, you need therapy.\n\n  ego-fest?  geez.  is there _nothing_ that can help you get out of your\n  sick preoccupation with _me_?  but who's surprised?  you didn't\n  understand _anything_ in that message, as was predicted therein.\n\n#:Erik\n\n",
          "references": [],
          "thread_id": "loop_syntax"
        },
        {
          "id": "3164778027675622@naggum.no",
          "subject": "Re: Loop Syntax",
          "author_id": "erik_naggum",
          "date": "2000-04-15",
          "display_date": "04/15/2000",
          "content": "\nSubject: Re: Loop Syntax\nFrom: Erik Naggum <erik@naggum.no>\nDate: 2000/04/15\nNewsgroups: comp.lang.lisp\nMessage-ID: <3164778027675622@naggum.no>\n\n* Courageous <jkraska1@san.rr.com>\n| Oh I understood what you *want* well enough, but life's simply not like\n| that.  When you behave the way you have, certain social consequences are\n| part of the natural order of things.  Contemplate it.\n\n  so you _do_ realize that!  but of course, it applies only to other people\n  and you're exempt from the rules that apply to other people, aren't you?\n\n  focus on _yourself_.  care about _yourself_.  let other people focus on\n  themselves and care about themselves.  get off the \"getting personal\"\n  track and focus on _your_ needs, discuss matters that matter to _you_,\n  and learn what you came to learn, if you _did_ come to learn anything\n  instead of merely posturing as a moron with an agenda.  by continuing to\n  taking this so _personally_ you display a personal insecurity that is\n  disgusting to behold and which is of no value to anyone to know about in\n  the first place.  \"contemplate it.\"\n\n#:Erik\n\n",
          "references": [],
          "thread_id": "loop_syntax"
        }
      ],
      "post_count": 6,
      "first_post_date": "2000-04-07",
      "last_post_date": "2000-04-15"
    },
    {
      "id": "how_to_make_'(--a)_equals_'a",
      "title": "How To make '(--a) equals 'a",
      "posts": [
        {
          "id": "3164645518513769@naggum.no",
          "subject": "Re: How To make '(--a) equals 'a",
          "author_id": "erik_naggum",
          "date": "2000-04-13",
          "display_date": "04/13/2000",
          "content": "\nSubject: Re: How To make '(--a) equals 'a\nFrom: Erik Naggum <erik@naggum.no>\nDate: 2000/04/13\nNewsgroups: comp.lang.lisp\nMessage-ID: <3164645518513769@naggum.no>\n\n* David <tiand8@cs.man.ac.uk>\n| I am a beginner in Lisp. Recently I have been doing a programming\n| exercise in Lisp which is to build a test-tree using a so-called ID3\n| algorithm in A.I. one of the smaller tasks to solve this problem is to\n| make \"not not a\" (ie. '(--a) ) equals \"a\"; where \"a\" is any atom in\n| Lisp. This is trivial in Maths, but to make this equivalence work in Lisp\n| seems very tricky to me. My main difficulty is that I don't know how to\n| separate '(--a) into \"-\", \"-\" and \"a\". once I know how to do this the\n| problem is straight forward.\n\n  if you use a richer character set, you can use the  operator (found in\n  ISO 8859-1, or \"ISO Latin 1\", also known among Microsoft victims as \"the\n  ANSI character set\"), and you can teach your Common Lisp reader to make\n  that a single-character operator that either returns itself or returns\n  the \"not\" operator already in the language, listifying its argument like\n  quote (') does.\n\n(defun not-reader (stream char)\n  (list 'not (read stream nil nil t)))\n\n(set-macro-character #\\ #'not-reader nil)\n\n'a\n=> (not (not a))\n\n  simplifying this expression can now be done at the semantic level, which\n  basically entails walking over your expressions looking for not forms and\n  replacing the form with the cadadr of the form.\n\n  the normal evaluation rules in Common Lisp makes (not (not a)) the\n  canonical true boolean value, t, for any non-nil a, and nil for nil.\n\n  don't know if this answered your question, it's kind of vague.\n\n#:Erik\n\n",
          "references": [],
          "thread_id": "how_to_make_'(--a)_equals_'a"
        },
        {
          "id": "3164729905914698@naggum.no",
          "subject": "Re: How To make '(--a) equals 'a",
          "author_id": "erik_naggum",
          "date": "2000-04-14",
          "display_date": "04/14/2000",
          "content": "\nSubject: Re: How To make '(--a) equals 'a\nFrom: Erik Naggum <erik@naggum.no>\nDate: 2000/04/14\nNewsgroups: comp.lang.lisp\nMessage-ID: <3164729905914698@naggum.no>\n\n* William Deakin <willd@pindar.com>\n| You are unduly harsh on vi, as there are sufficient problems with `Numerical\n| Recipies in C' that are total not vi related,\n\n  could \"Numerical Recipes in Common Lisp\" be an idea?  as far as I can see\n  from the code in the C version, about 40% of it is directly related to\n  managing object types that don't fall naturally into the C domain, and it\n  appears that the significant reduction in object management alone would\n  make a Common Lisp implementation of much if not all of this interesting.\n\n#:Erik\n\n",
          "references": [],
          "thread_id": "how_to_make_'(--a)_equals_'a"
        }
      ],
      "post_count": 2,
      "first_post_date": "2000-04-13",
      "last_post_date": "2000-04-14"
    },
    {
      "id": "allegrocl:_how_to_write_a_huge_list_in_one_line",
      "title": "AllegroCL: How to write a huge list in one line",
      "posts": [
        {
          "id": "3164396968656316@naggum.no",
          "subject": "Re: AllegroCL: How to write a huge list in one line",
          "author_id": "erik_naggum",
          "date": "2000-04-10",
          "display_date": "04/10/2000",
          "content": "\nSubject: Re: AllegroCL: How to write a huge list in one line\nFrom: Erik Naggum <erik@naggum.no>\nDate: 2000/04/10\nNewsgroups: comp.lang.lisp\nMessage-ID: <3164396968656316@naggum.no>\n\n* Unai Uribarri Rodriguez <zz99f029@opalo.etsiig.uniovi.es>\n| format splits the list into several lines.\n\n  format does what it's told to do, and it doesn't have free will (it only\n  feels like it until you learn its language), so you're blaming the wrong\n  guy, here.  so, what, _exactly_, were you telling format to do?\n\n| Is there any way to write a huge list to a file in an unique line?\n\n(format <stream> \"~{~A~^ ~}~%\" <huge-list>)\n\n#:Erik\n\n",
          "references": [],
          "thread_id": "allegrocl:_how_to_write_a_huge_list_in_one_line"
        }
      ],
      "post_count": 1,
      "first_post_date": "2000-04-10",
      "last_post_date": "2000-04-10"
    },
    {
      "id": "list_problem_and_nth,_read,_strcat",
      "title": "list problem and NTH, READ, STRCAT",
      "posts": [
        {
          "id": "3164366538827789@naggum.no",
          "subject": "Re: list problem and NTH, READ, STRCAT",
          "author_id": "erik_naggum",
          "date": "2000-04-10",
          "display_date": "04/10/2000",
          "content": "\nSubject: Re: list problem and NTH, READ, STRCAT\nFrom: Erik Naggum <erik@naggum.no>\nDate: 2000/04/10\nNewsgroups: comp.lang.lisp\nMessage-ID: <3164366538827789@naggum.no>\n\n* Rahul Jain <rahul@rice.edu>\n| (defun do-this (lis1 lis2)\n|     (let ((both-lis (append lis1 lis2)))\n|          (do-something-with-both-lis ...)\n|          (reverse both-lis)))\n| \n| To a lisp-person, that's much easier to understand.\n\n  really?  I wonder what a \"lis\" is.  does lisp return t on it?  :)\n\n#:Erik\n\n",
          "references": [],
          "thread_id": "list_problem_and_nth,_read,_strcat"
        }
      ],
      "post_count": 1,
      "first_post_date": "2000-04-10",
      "last_post_date": "2000-04-10"
    },
    {
      "id": "basic_question_(probably_w/_no_good_answer)",
      "title": "basic question (probably w/ no good answer)",
      "posts": [
        {
          "id": "3164210231625803@naggum.no",
          "subject": "Re: basic question (probably w/ no good answer)",
          "author_id": "erik_naggum",
          "date": "2000-04-08",
          "display_date": "04/08/2000",
          "content": "\nSubject: Re: basic question (probably w/ no good answer)\nFrom: Erik Naggum <erik@naggum.no>\nDate: 2000/04/08\nNewsgroups: comp.lang.lisp\nMessage-ID: <3164210231625803@naggum.no>\n\n* Joe Marshall <jmarshall@alum.mit.edu>\n| The time you might `save' in compilation is negligable, a decent compiler\n| would produce similar code in either case, even if the code were\n| different, I can't imagine it would be so different as to have a\n| noticable impact on performance or code size, and if it *really* made a\n| noticable difference, I'd imagine that the compiler would be so piss-poor\n| as to be virtually unusable.\n\n  I think \"helping the compiler\" (not expressed in so many words, but in\n  meaning) is a metaphor that relates to the \"sufficiently smart compiler\",\n  and that it is not directly related to any actual assistance.  it's more\n  like \"would it hamper the smart compiler's ability to be as smart as it\n  could be\", or, as David put it \"do the right thing\".  I don't think so,\n  but it's a good question, nonetheless.  Rob pointed out that releasing\n  the hold on the objects might help (again, metaphorically) the garbage\n  collector pick up dead objects earlier, although it is hard for me right\n  now to imagine how this could b affected: scope analysis would cause the\n  bindings to go out of scope either way, and if these variables were in\n  call-frame slots or registers, they wouldn't necessarily be any more\n  garbage unless these slots were explicitly set to nil or something\n  similarly drastic (because the savings would be so limited compared to\n  the cost of doing this all over the place).\n\n| Making a hard-and-fast rule about this would lead to ridiculous coding\n| style if taken to the limit.\n\n  I'll trust readers of hard-and-fast rules to exercise their judgment and\n  not take things to ridiculous limits.\n\n  I think the question merits thought -- it's one of those small things\n  that it's too easy to waste time on because we're _not_ thinking about\n  it, and I for one think this question and questions like it would make it\n  a lot easier for more experienced programmers to help new programmers get\n  a feel for the language in actual use.  this is the \"experience\" part\n  that you get from reading lots of code and spending your working hours\n  among other Lisp programmers.  I think it's nice to see this newsgroup\n  assume part of that role, too.\n\n#:Erik\n\n",
          "references": [],
          "thread_id": "basic_question_(probably_w/_no_good_answer)"
        },
        {
          "id": "3164150875655283@naggum.no",
          "subject": "Re: basic question (probably w/ no good answer)",
          "author_id": "erik_naggum",
          "date": "2000-04-08",
          "display_date": "04/08/2000",
          "content": "\nSubject: Re: basic question (probably w/ no good answer)\nFrom: Erik Naggum <erik@naggum.no>\nDate: 2000/04/08\nNewsgroups: comp.lang.lisp\nMessage-ID: <3164150875655283@naggum.no>\n\n* Dave Bakhash <cadet@alum.mit.edu>\n| My guess: don't close off the LET, but keep things nested, even\n| though those final expressions don't need to be inside the LET.\n\n  my rule of thumb: unless you use a binding form for its progn value,\n  i.e., in situations where you may use only one form, move the subforms\n  that don't need the bindings out of the binding form.  this makes it\n  clear when the scope of the bindings cease to exist, reducing the amount\n  of work a reader of the code would have to go through to figure out that\n  the bindings _don't_ affect these forms, and it makes it clear that the\n  binding form does not return a useful value, but is there for side\n  effect.  clues like this can make reading code a lot easier.\n\n  this is likely a matter of some personal taste.\n\n#:Erik\n\n",
          "references": [],
          "thread_id": "basic_question_(probably_w/_no_good_answer)"
        }
      ],
      "post_count": 2,
      "first_post_date": "2000-04-08",
      "last_post_date": "2000-04-08"
    },
    {
      "id": "more_questions_about_threads...",
      "title": "more questions about threads...",
      "posts": [
        {
          "id": "3163949210384068@naggum.no",
          "subject": "Re: more questions about threads...",
          "author_id": "erik_naggum",
          "date": "2000-04-05",
          "display_date": "04/05/2000",
          "content": "\nSubject: Re: more questions about threads...\nFrom: Erik Naggum <erik@naggum.no>\nDate: 2000/04/05\nNewsgroups: comp.lang.lisp\nMessage-ID: <3163949210384068@naggum.no>\n\n* Tim Bradshaw <tfb@cley.com>\n| I doubt performance of sunos 4.1.3 says anything about recent solaris\n| as that was before all the multiprocessor support in sunos 5 (I'm not\n| even sure how much code they share, probably very little).\n\n  note that I was talking about the consumption of PIDs, not performance.\n  this has to do with the number of scripts and invoked interpreters and\n  such, which may or may not impact performance.  what I was suggesting was\n  that Linux is very heavily script-and-interpreters-oriented, while BSD-\n  based Unices have traditionally been less so than AT&T-based Unices, for\n  whatever this is worth.  in any case, I would expect Linux to be faster\n  at forking _because_ it is used so much more.  Linux was heavily into\n  this mode of thinking long before it had SMP support.\n\n#:Erik\n\n",
          "references": [],
          "thread_id": "more_questions_about_threads..."
        },
        {
          "id": "3163944808069043@naggum.no",
          "subject": "Re: more questions about threads...",
          "author_id": "erik_naggum",
          "date": "2000-04-05",
          "display_date": "04/05/2000",
          "content": "\nSubject: Re: more questions about threads...\nFrom: Erik Naggum <erik@naggum.no>\nDate: 2000/04/05\nNewsgroups: comp.lang.lisp\nMessage-ID: <3163944808069043@naggum.no>\n\n* David Hanley <djh@ncgr.org>\n| And perhaps more critically: the ability to make use of more than one\n| CPU if present.\n\n  yet this may be what slows down the threads and speeds up the processes.\n\n  I think a valuable benchmarking approach would be test the same kind of\n  communication between the various kinds of processes, like sockets and\n  some simple protocol.\n\n#:Erik\n\n",
          "references": [],
          "thread_id": "more_questions_about_threads..."
        },
        {
          "id": "3163959816816739@naggum.no",
          "subject": "Re: more questions about threads...",
          "author_id": "erik_naggum",
          "date": "2000-04-05",
          "display_date": "04/05/2000",
          "content": "\nSubject: Re: more questions about threads...\nFrom: Erik Naggum <erik@naggum.no>\nDate: 2000/04/05\nNewsgroups: comp.lang.lisp\nMessage-ID: <3163959816816739@naggum.no>\n\n* Andrew Cooke <andrew@andrewcooke.free-online.co.uk>\n| I don't have multithreaded Lisp experience, but work in Java, where\n| threads are part of the standard language, and they are invaluable in\n| making responsive, robust systems without complicated coupling between\n| separate parts of the program.  So they often help *good design*.\n\n  you don't need OS support to make this work the way you want.  the desire\n  for OS support can often lead you to dismiss what you can actually do as\n  \"undesirable\".  many would-be CL users have run into this \"mindset trap\"\n  where they refuse to use Common Lisp because they have this fixation that\n  some feature or another must be \"standard\" before they can use it.\n\n  investigate your Common Lisp environment.  programming only in Common\n  Lisp as per the standard _only_ is like programming in any other language\n  as per the standard _only_ (with the exception that you can actually get\n  quite a lot of interesting work done in standard CL) -- ignoring the\n  programming environment (such as Allegro CL for CL, and Unix for C) is\n  just plain stupid.\n\n#:Erik\n\n",
          "references": [],
          "thread_id": "more_questions_about_threads..."
        },
        {
          "id": "3163944702587593@naggum.no",
          "subject": "Re: more questions about threads...",
          "author_id": "erik_naggum",
          "date": "2000-04-05",
          "display_date": "04/05/2000",
          "content": "\nSubject: Re: more questions about threads...\nFrom: Erik Naggum <erik@naggum.no>\nDate: 2000/04/05\nNewsgroups: comp.lang.lisp\nMessage-ID: <3163944702587593@naggum.no>\n\n* Tim Bradshaw <tfb@cley.com>\n| I'm not sure what if anything this says, except that solaris has fast\n| thread creation perhaps. I'd kind of expect their thread impl to be\n| pretty good because their market is big multiprocessor machines.\n\n  I'd also expect Sun to want a \"favorable demo\" effect that shows this.\n  Linux has made fork exceptionally fast (my experience is that PIDs are\n  used up about three times faster under Linux than under SunOS 4.1.3_U1,\n  with equivalent work being performed on the systems), and has implemented\n  the performance sensitive parts of vfork in fork.  ironically, it now\n  appears that threads have to do _more_ work than processes because they\n  _share_ the memory and a bunch of other stuff that fork splits off into\n  objects with distinct identity.\n\n#:Erik\n\n",
          "references": [],
          "thread_id": "more_questions_about_threads..."
        },
        {
          "id": "3164024042624368@naggum.no",
          "subject": "Re: more questions about threads...",
          "author_id": "erik_naggum",
          "date": "2000-04-06",
          "display_date": "04/06/2000",
          "content": "\nSubject: Re: more questions about threads...\nFrom: Erik Naggum <erik@naggum.no>\nDate: 2000/04/06\nNewsgroups: comp.lang.lisp\nMessage-ID: <3164024042624368@naggum.no>\n\n* David Hanley <djh@ncgr.org>\n| Not for every app.  I have an app which runs on a multiple CPU machine,\n| and needs to generate a number of images ( time intensive ).  I shoot off\n| a number of threads to work on the image ( one each ) and this makes the\n| whole thing happen a *lot* faster.\n\n  how do they communicate the results back to eachother or a master?\n\n#:Erik\n\n",
          "references": [],
          "thread_id": "more_questions_about_threads..."
        }
      ],
      "post_count": 5,
      "first_post_date": "2000-04-05",
      "last_post_date": "2000-04-06"
    },
    {
      "id": "setf_functions",
      "title": "setf functions",
      "posts": [
        {
          "id": "3163950557082770@naggum.no",
          "subject": "Re: setf functions",
          "author_id": "erik_naggum",
          "date": "2000-04-05",
          "display_date": "04/05/2000",
          "content": "\nSubject: Re: setf functions\nFrom: Erik Naggum <erik@naggum.no>\nDate: 2000/04/05\nNewsgroups: comp.lang.lisp\nMessage-ID: <3163950557082770@naggum.no>\n\n* Harald Hanche-Olsen <hanche@math.ntnu.no>\n| My point is that, as far as I can understand the Hyperspec, there is\n| no way to do this for a function returning multiple values, since the\n| form should be a place, which by definition can only refer to a single\n| value.  I'd love to be proved wrong on this one, though.  Or even if I\n| am right, maybe there is a more natural way to attack the problem?\n\n  apart from actually working, what's wrong with this example?\n\n(defstruct display\n  x y)\n\n(defun global-pointer-position (object)\n  (values (display-x object) (display-y object)))\n\n(defsetf global-pointer-position (object) (new-x new-y)\n  `(setf (display-x ,object) ,new-x\n\t (display-y ,object) ,new-y))\n\n#:Erik\n\n",
          "references": [],
          "thread_id": "setf_functions"
        },
        {
          "id": "3164020402912136@naggum.no",
          "subject": "Re: setf functions",
          "author_id": "erik_naggum",
          "date": "2000-04-06",
          "display_date": "04/06/2000",
          "content": "\nSubject: Re: setf functions\nFrom: Erik Naggum <erik@naggum.no>\nDate: 2000/04/06\nNewsgroups: comp.lang.lisp\nMessage-ID: <3164020402912136@naggum.no>\n\n* Marco Antoniotti <marcoxa@parades.rm.cnr.it>\n| What about this?\n| \n| (defun (setf global-pointer-position) (new-x new-y object)\n|   (setf (values (display-x object) (display-y object))\n|         (values new-x new-y)))\n| \n| It does not work in CMUCL, but I believe it should (modulo my\n| understanding on the CLHS)\n\n  that would mean the call would have to be\n\n(setf (global-pointer-position new-y object) new-x)\n\n  this is not what we want.\n\n#:Erik\n\n",
          "references": [],
          "thread_id": "setf_functions"
        }
      ],
      "post_count": 2,
      "first_post_date": "2000-04-05",
      "last_post_date": "2000-04-06"
    },
    {
      "id": "howto_string->symbol",
      "title": "howto string->symbol",
      "posts": [
        {
          "id": "3163878195909751@naggum.no",
          "subject": "Re: howto string->symbol",
          "author_id": "erik_naggum",
          "date": "2000-04-04",
          "display_date": "04/04/2000",
          "content": "\nSubject: Re: howto string->symbol\nFrom: Erik Naggum <erik@naggum.no>\nDate: 2000/04/04\nNewsgroups: comp.lang.lisp\nMessage-ID: <3163878195909751@naggum.no>\n\n* Raymond Toy <toy@rtp.ericsson.se>\n| While I understood the nice explanation snipped out above, could you\n| explain more fully exactly what you mean by \"WYSIWYG print names\"?\n\n  symbols whose print names are what you see, i.e., no case conversion\n  either on input or on output.\n\n  please note that I'm no more a fan of upper-case Common Lisp code than\n  those who gave Common Lisp *print-case* and readtable-case were.\n\n#:Erik\n\n",
          "references": [],
          "thread_id": "howto_string->symbol"
        },
        {
          "id": "3163862476772157@naggum.no",
          "subject": "Re: howto string->symbol",
          "author_id": "erik_naggum",
          "date": "2000-04-04",
          "display_date": "04/04/2000",
          "content": "\nSubject: Re: howto string->symbol\nFrom: Erik Naggum <erik@naggum.no>\nDate: 2000/04/04\nNewsgroups: comp.lang.lisp\nMessage-ID: <3163862476772157@naggum.no>\n\n* Tim Bradshaw <tfb@cley.com>\n| Sorry, my mistake, that should have been:\n| \n| \t(format nil \"~A~S\" (symbol-name ...) ...)\n\n  I'm not sure this is really good advice.\n\n  we really want to concatenate a few strings to make a new string.  format\n  does a whole bunch of weird stuff that may look right, but the exhaustive\n  test case is non-trivial to construct, and it really can't be caught any\n  other way until you know what you're doing with an exceptionally high\n  level of precision and attention to detail.  (since this topic comes up\n  every once in a while, a search engine hit rate increaser: static typing\n  -- it won't help at all in such interesting real-life cases.)\n\n  a simple mistake like using ~S with symbols involves the *print-case* of\n  symbols, which, while some people might be happy with the default, will\n  encounter a user who prefers to see lower-case symbol names, the same way\n  he writes them, and it bombs in ways mysterious to the uninitiate.\n\n  a simple mistake like using ~S with numbers involves the *print-base* of\n  numbers, and if the programmer has the skills to set *print-radix* to\n  true while using non-standard read bases, its effects intervene, too.\n\n(let ((*print-case* :downcase)\n      (*print-base* 3)\n      (*print-radix* t))\n  (format nil \"~S~S\" 'hello 3))\n=> \"hello#3r10\"\n\n  format is exceptionally good at producing output suitable for humans.  it\n  is not very good at producing values suitable for the Lisp reader, yet it\n  is so often called upon to do that it hurts.  here's a different solution\n  that uses the proper tools for the job, in my usual, unhumble opinion:\n\n(with-output-to-string (*standard-output*)\n  (with-standard-io-syntax\n    (prin1 'hello)\n    (prin1 3)))\n=> \"HELLO3\"\n\n  an \"optimized\" solution suitable for direct consumption for intern, which\n  is what's really sought in this case:\n\n(concatenate 'string\n    (symbol-name 'hello)\n    (with-standard-io-syntax\n      (write-to-string 3)))\n=> \"HELLO3\"\n\n  this might look less convenient than the wrong format solution, but\n  that's why we have defun.  constructing a new symbol out of constituent\n  parts, however that is defined, is (more or less unfortunately) _not_\n  child's play -- it is a sufficiently specialized task that even \"software\n  pattern\" arguments that this should be an idiom fail: it is not something\n  users are likely to find just one pattern for, and if they find one,\n  it would probably be just as wrong as the wrong format solution.  in\n  other words, they need to find out how this stuff works, and then apply\n  that knowledge to their domain _every_ time.\n\n  incidentally, this is also one of the reasons I favor WYSIWYG print names\n  for symbols.  all of this symbol-hacking stuff would be _significantly_\n  simpler with agreement on that principle.\n\n#:Erik\n\n",
          "references": [],
          "thread_id": "howto_string->symbol"
        },
        {
          "id": "3163848847427556@naggum.no",
          "subject": "Re: howto string->symbol",
          "author_id": "erik_naggum",
          "date": "2000-04-04",
          "display_date": "04/04/2000",
          "content": "\nSubject: Re: howto string->symbol\nFrom: Erik Naggum <erik@naggum.no>\nDate: 2000/04/04\nNewsgroups: comp.lang.lisp\nMessage-ID: <3163848847427556@naggum.no>\n\n* kp gores <gores@sip.medizin.uni-ulm.de>\n| I probably have all  packages using \"SHARED\"  to re-use it??\n\n  why do you think you need to \"re-use\" those packages?\n\n| it seems like being a bad idea creating symbols which are shared over\n| packages!?\n\n  it might, but that depends on their purpose.\n\n#:Erik\n\n",
          "references": [],
          "thread_id": "howto_string->symbol"
        },
        {
          "id": "3163935044643945@naggum.no",
          "subject": "Re: howto string->symbol",
          "author_id": "erik_naggum",
          "date": "2000-04-05",
          "display_date": "04/05/2000",
          "content": "\nSubject: Re: howto string->symbol\nFrom: Erik Naggum <erik@naggum.no>\nDate: 2000/04/05\nNewsgroups: comp.lang.lisp\nMessage-ID: <3163935044643945@naggum.no>\n\n* kp gores <gores@sip.medizin.uni-ulm.de>\n| well, i didn't test it. but i thought that pack A using pack B knows \n| about only the (external) symbols of B existing at the time of using and \n| not later created symbols.\n\n  as I suspected, but I am curious, from an educational vantage point --\n  it's an odd assumption to make, in my view, and I wonder how you came to\n  think this way.  here's how I think: when you let a package use another\n  package, you refer to the package, as opposed to the symbols of the\n  package with, say, a use-package-symbols operator, which is what import\n  does, essentially.  my goal is to find out how to explain the difference\n  between import and use-package very succinctly.  it is not enough to\n  argue that the name \"use-package\" is sufficient, unless one also argues\n  that people pay _real_ good attention to the names, but whether that is\n  feasible or not is the underlying concern.\n\n#:Erik\n\n",
          "references": [],
          "thread_id": "howto_string->symbol"
        }
      ],
      "post_count": 4,
      "first_post_date": "2000-04-04",
      "last_post_date": "2000-04-05"
    },
    {
      "id": "concatenated-stream_-_which_component_is_being_rea",
      "title": "concatenated-stream - which component is being read from?",
      "posts": [
        {
          "id": "3163344737710362@naggum.no",
          "subject": "Re: concatenated-stream - which component is being read from?",
          "author_id": "erik_naggum",
          "date": "2000-03-29",
          "display_date": "03/29/2000",
          "content": "\nSubject: Re: concatenated-stream - which component is being read from?\nFrom: Erik Naggum <erik@naggum.no>\nDate: 2000/03/29\nNewsgroups: comp.lang.lisp\nMessage-ID: <3163344737710362@naggum.no>\n\n* Sam Steingold <sds@gnu.org>\n| Is there a way to figure out which component of a concatenated stream is\n| being read from?\n\n  from the definition of concatenated-stream-streams:\n\nReturns a list of input streams that constitute the ordered set of streams\nthe concatenated-stream still has to read from, starting with the current\none it is reading from. The list may be empty if no more streams remain to\nbe read.\n\n#:Erik\n\n",
          "references": [],
          "thread_id": "concatenated-stream_-_which_component_is_being_rea"
        },
        {
          "id": "3163863401819617@naggum.no",
          "subject": "Re: concatenated-stream - which component is being read from?",
          "author_id": "erik_naggum",
          "date": "2000-04-04",
          "display_date": "04/04/2000",
          "content": "\nSubject: Re: concatenated-stream - which component is being read from?\nFrom: Erik Naggum <erik@naggum.no>\nDate: 2000/04/04\nNewsgroups: comp.lang.lisp\nMessage-ID: <3163863401819617@naggum.no>\n\n* hoehle-sorry@tzd.dont.telekom.spam.de.me (Joerg-Cyril Hoehle)\n| I believe there's a need for *particular* objects which *will* close\n| constituents when it has finished with them.\n\n  you _could_ define an after method on read-char and read-byte on that\n  stream that would close it once it got exhausted, using the widely\n  available Grey streams, or something better if and when it comes along\n  with such features available.  (hi, Duane!  hint for the taking!  :)\n\n  in an application that needed a little simpler life than it could get out\n  of the box, I added code to the socket layer this way to automatically\n  shut down the input side, forcing an EOF that consequently shut down the\n  output side gracefully as well when they ran into trouble of any kind, as\n  the socket error handling in most Unices is a disgraceful mess of special\n  cases that neither match nor attempt to match the TCP or IP\n  specifications.\n\n#:Erik\n\n",
          "references": [],
          "thread_id": "concatenated-stream_-_which_component_is_being_rea"
        }
      ],
      "post_count": 2,
      "first_post_date": "2000-03-29",
      "last_post_date": "2000-04-04"
    },
    {
      "id": "alternatives_to_eval",
      "title": "Alternatives to EVAL",
      "posts": [
        {
          "id": "3163690457188144@naggum.no",
          "subject": "Re: Alternatives to EVAL",
          "author_id": "erik_naggum",
          "date": "2000-04-02",
          "display_date": "04/02/2000",
          "content": "\nSubject: Re: Alternatives to EVAL\nFrom: Erik Naggum <erik@naggum.no>\nDate: 2000/04/02\nNewsgroups: comp.lang.lisp\nMessage-ID: <3163690457188144@naggum.no>\n\n* \"David E. Young\" <youngde@mindspring.com>\n| I've read that if EVAL is used explicitly within a program, it probably\n| indicates poor design.\n\n  the probability is not 1.0, however.  using EVAL in servers or programs\n  that accept input from users or agents of users for the express purpose\n  of evaluation in the Lisp world is good design -- reinventing your own\n  EVAL at this point is poor design.\n\n#:Erik\n\n",
          "references": [],
          "thread_id": "alternatives_to_eval"
        },
        {
          "id": "3163862636948799@naggum.no",
          "subject": "Re: Alternatives to EVAL",
          "author_id": "erik_naggum",
          "date": "2000-04-04",
          "display_date": "04/04/2000",
          "content": "\nSubject: Re: Alternatives to EVAL\nFrom: Erik Naggum <erik@naggum.no>\nDate: 2000/04/04\nNewsgroups: comp.lang.lisp\nMessage-ID: <3163862636948799@naggum.no>\n\n* Scott L. Burson\n| I would additionally suggest going a bit further and making a package\n| that contains *only* the symbols you will need to read.  This will limit\n| what the incoming forms can do when EVALed... which would make me a lot\n| more comfortable with this design.\n\n  it's even a little worse than you sketch out.  ideally, you should be\n  able to force intern not to intern, i.e. to have read call find-symbol\n  and barf on uninterned symbols.  ideally, you should be able to force the\n  symbol-reader to barf on _any_ package specification other than those you\n  have specified.  neither of these are possible in fully conforming code.\n\n#:Erik\n\n",
          "references": [],
          "thread_id": "alternatives_to_eval"
        }
      ],
      "post_count": 2,
      "first_post_date": "2000-04-02",
      "last_post_date": "2000-04-04"
    },
    {
      "id": "dangling_closing_parentheses_vs._stacked_closing_p",
      "title": "Dangling Closing Parentheses vs. Stacked Closing Parentheses",
      "posts": [
        {
          "id": "3163031395198264@naggum.no",
          "subject": "Re: Dangling Closing Parentheses vs. Stacked Closing Parentheses",
          "author_id": "erik_naggum",
          "date": "2000-03-26",
          "display_date": "03/26/2000",
